{
  "required" : true ,
  "$schema" : "http://json-schema.org/draft-03/schema" ,
  "type" : "object" ,
  "properties" : {
    "importInfo" : {
      "type" : "object" ,
      "required" : false ,
      "properties" : {
        "purpose" : {
          "type" : "string" ,
          "required" : false
        } ,
        "dataImportPriorityId" : {
          "type" : "string" ,
          "required" : false
        } ,
        "sourceFieldIds" : {
          "type" : "array" ,
          "required" : false ,
          "items" : [
            {
              "type" : "object"
            }
          ]
        } ,
        "fieldMappings" : {
          "type" : "array" ,
          "required" : false ,
          "items" : [
            {
              "type" : "object" ,
              "properties" : {
                "sourceFieldId" : {
                  "type" : "string" ,
                  "required" : false
                } ,
                "targetFieldId" : {
                  "type" : "string" ,
                  "required" : false
                } ,
                "isLookup" : {
                  "type" : "string" ,
                  "required" : false
                } ,
                "updateType" : {
                  "type" : "string" ,
                  "required" : false
                }
              }
            }
          ]
        } ,
        "notification" : {
          "type" : "object" ,
          "required" : false
        } ,
        "listId" : {
          "type" : "string" ,
          "required" : false
        } ,
        "isAutomated" : {
          "type" : "string" ,
          "required" : false
        } ,
        "lastUpdatedSourceFieldsAt" : {
          "type" : "string" ,
          "required" : false
        } ,
        "name" : {
          "type" : "string" ,
          "required" : false
        } ,
        "description" : {
          "type" : "string" ,
          "required" : false
        } ,
        "permissions" : {
          "type" : "string" ,
          "required" : false
        } ,
        "folderId" : {
          "type" : "string" ,
          "required" : false
        } ,
        "sourceTemplateId" : {
          "type" : "string" ,
          "required" : false
        } ,
        "createdBy" : {
          "type" : "string" ,
          "required" : false
        } ,
        "createdAt" : {
          "type" : "string" ,
          "required" : false
        } ,
        "updatedBy" : {
          "type" : "string" ,
          "required" : false
        } ,
        "updatedAt" : {
          "type" : "string" ,
          "required" : false
        } ,
        "accessedAt" : {
          "type" : "string" ,
          "required" : false
        } ,
        "scheduledFor" : {
          "type" : "string" ,
          "required" : false
        } ,
        "depth" : {
          "type" : "string" ,
          "required" : false
        }
      }
    } ,
    "sourceConnection" : {
      "type" : "object" ,
      "required" : false ,
      "properties" : {
        "hostname" : {
          "type" : "string" ,
          "required" : false
        } ,
        "username" : {
          "type" : "string" ,
          "required" : false
        } ,
        "password" : {
          "type" : "string" ,
          "required" : false
        } ,
        "port" : {
          "type" : "string" ,
          "required" : false
        } ,
        "name" : {
          "type" : "string" ,
          "required" : false
        } ,
        "description" : {
          "type" : "string" ,
          "required" : false
        } ,
        "permissions" : {
          "type" : "string" ,
          "required" : false
        } ,
        "folderId" : {
          "type" : "string" ,
          "required" : false
        } ,
        "sourceTemplateId" : {
          "type" : "string" ,
          "required" : false
        } ,
        "createdBy" : {
          "type" : "string" ,
          "required" : false
        } ,
        "createdAt" : {
          "type" : "string" ,
          "required" : false
        } ,
        "updatedBy" : {
          "type" : "string" ,
          "required" : false
        } ,
        "updatedAt" : {
          "type" : "string" ,
          "required" : false
        } ,
        "accessedAt" : {
          "type" : "string" ,
          "required" : false
        } ,
        "scheduledFor" : {
          "type" : "string" ,
          "required" : false
        } ,
        "depth" : {
          "type" : "string" ,
          "required" : false
        }
      }
    } ,
    "sourcePath" : {
      "type" : "string" ,
      "required" : false
    } ,
    "executedAt" : {
      "type" : "string" ,
      "required" : false
    } ,
    "executionStatus" : {
      "type" : "string" ,
      "required" : false
    } ,
    "schedule" : {
      "type" : "object" ,
      "required" : false ,
      "properties" : {
        "displayTimeZoneId" : {
          "type" : "string" ,
          "required" : false
        } ,
        "details" : {
          "type" : "object" ,
          "required" : false ,
          "properties" : {
            "dailyStartTime" : {
              "type" : "string" ,
              "required" : false
            } ,
            "dailyEndTime" : {
              "type" : "string" ,
              "required" : false
            } ,
            "days" : {
              "type" : "array" ,
              "required" : false ,
              "items" : [
                {
                  "type" : "object"
                }
              ]
            }
          }
        } ,
        "executionInterval" : {
          "type" : "string" ,
          "required" : false
        }
      }
    } ,
    "name" : {
      "type" : "string" ,
      "required" : false
    } ,
    "description" : {
      "type" : "string" ,
      "required" : false
    } ,
    "permissions" : {
      "type" : "string" ,
      "required" : false
    } ,
    "folderId" : {
      "type" : "string" ,
      "required" : false
    } ,
    "sourceTemplateId" : {
      "type" : "string" ,
      "required" : false
    } ,
    "createdBy" : {
      "type" : "string" ,
      "required" : false
    } ,
    "createdAt" : {
      "type" : "string" ,
      "required" : false
    } ,
    "updatedBy" : {
      "type" : "string" ,
      "required" : false
    } ,
    "updatedAt" : {
      "type" : "string" ,
      "required" : false
    } ,
    "accessedAt" : {
      "type" : "string" ,
      "required" : false
    } ,
    "scheduledFor" : {
      "type" : "string" ,
      "required" : false
    } ,
    "depth" : {
      "type" : "string" ,
      "required" : false
    }
  }
}