{
  "executedAt" : "undefined" ,
  "executionStatus" : "undefined" ,
  "schedule" : {
    "displayTimeZoneId" : "undefined" ,
    "details" : {
      "dailyStartTime" : "undefined" ,
      "dailyEndTime" : "undefined" ,
      "days" : [
        null ,
        null
      ]
    } ,
    "executionInterval" : "undefined"
  } ,
  "name" : "undefined" ,
  "description" : "Eloqua" ,
  "permissions" : "undefined" ,
  "folderId" : "undefined" ,
  "sourceTemplateId" : "undefined" ,
  "createdBy" : "undefined" ,
  "createdAt" : "undefined" ,
  "updatedBy" : "undefined" ,
  "updatedAt" : "undefined" ,
  "accessedAt" : "undefined" ,
  "scheduledFor" : "undefined" ,
  "depth" : "minimal"
}